{
  "bug_type": "value misuse",
  "failure_symptoms": "degree undercounts a node's neighbours by one.",
  "operator": "constant-delta",
  "difficulty": "easy",
  "provenance": {
    "origin": "operator-catalog",
    "generator": "catalog:babel:authored",
    "seed": 126,
    "engine_version": "@babel/parser@8.0.6"
  },
  "validation": {
    "f2p": [
      "counts the neighbours of a node"
    ],
    "p2p": [
      "finds a directed edge",
      "returns a copy of the neighbour list",
      "detects a self-loop among several nodes",
      "returns false when the target is unreachable"
    ],
    "fix": {
      "src/edges.ts": "export type Adjacency = Record<string, string[]>;\n\nexport function degree(adj: Adjacency, node: string): number {\n  return (adj[node] ?? []).length;\n}\n\nexport function hasEdge(adj: Adjacency, a: string, b: string): boolean {\n  return (adj[a] ?? []).includes(b);\n}\n"
    }
  },
  "adequacy": {
    "file": "src/edges.ts",
    "delete": "return (adj[node] ?? []).length;"
  },
  "tell_audit": {
    "critic": "lane-leader adversarial diff read (tests withheld)",
    "verdict": "not-told",
    "notes": "A literal change; trivial-prone and easy-tier only."
  }
}
