{
  "bug_type": "operator misuse",
  "failure_symptoms": "wordCount counts surrounding whitespace as extra words.",
  "operator": "chain-break",
  "difficulty": "medium",
  "provenance": {
    "origin": "lm-injected",
    "generator": "lane-leader-lm",
    "seed": 0,
    "engine_version": "lm"
  },
  "validation": {
    "f2p": [
      "counts words ignoring surrounding whitespace"
    ],
    "p2p": [
      "lowercases and hyphen-joins words",
      "returns the text unchanged at the limit",
      "averages the word lengths"
    ],
    "fix": {
      "src/count.ts": "export function wordCount(text: string): number {\n  return text.trim().split(/\\s+/).length;\n}\n\nexport function averageWordLength(text: string): number {\n  const words = text.trim().split(/\\s+/);\n  const total = words.reduce((sum, word) => sum + word.length, 0);\n  return total / words.length;\n}\n"
    }
  },
  "adequacy": {
    "file": "src/count.ts",
    "delete": "return text.trim().split(/\\s+/).length;"
  },
  "tell_audit": {
    "critic": "lane-leader adversarial diff read (tests withheld)",
    "verdict": "not-told",
    "notes": "A dropped trim in a chain; the whitespace symptom is not in the diff."
  }
}
