{
  "bug_type": "operator misuse",
  "failure_symptoms": "reachable reports an unreachable target as reachable.",
  "operator": "equality-boundary",
  "difficulty": "medium",
  "provenance": {
    "origin": "operator-catalog",
    "generator": "catalog:babel:EqualityOperator",
    "seed": 128,
    "engine_version": "@stryker-mutator/instrumenter@10.0.0"
  },
  "validation": {
    "f2p": [
      "returns false when the target is unreachable"
    ],
    "p2p": [
      "counts the neighbours of a node",
      "finds a directed edge",
      "returns a copy of the neighbour list",
      "detects a self-loop among several nodes"
    ],
    "fix": {
      "src/bfs.ts": "import type { Adjacency } from './edges.ts';\n\nexport function reachable(adj: Adjacency, start: string, target: string): boolean {\n  const seen = new Set<string>([start]);\n  const queue = [start];\n  while (queue.length > 0) {\n    const node = queue.shift()!;\n    if (node === target) return true;\n    for (const next of adj[node] ?? []) {\n      if (!seen.has(next)) {\n        seen.add(next);\n        queue.push(next);\n      }\n    }\n  }\n  return false;\n}\n"
    }
  },
  "adequacy": {
    "file": "src/bfs.ts",
    "delete": "return false;"
  },
  "tell_audit": {
    "critic": "lane-leader adversarial diff read (tests withheld)",
    "verdict": "not-told",
    "notes": "An equality flip; the unreachable contract is test-only."
  }
}
