{
  "bug_type": "value misuse",
  "failure_symptoms": "parseAmount parses a hex-looking string as base sixteen.",
  "operator": "radix-coercion-drop",
  "difficulty": "medium",
  "provenance": {
    "origin": "operator-catalog",
    "generator": "catalog:ts-morph",
    "seed": 133,
    "engine_version": "ts-morph@28.0.0"
  },
  "validation": {
    "f2p": [
      "parses a decimal string as base ten"
    ],
    "p2p": [
      "rejects an address without a dotted domain",
      "keeps a value inside the range",
      "lists the missing fields"
    ],
    "fix": {
      "src/number.ts": "export function parseAmount(text: string): number {\n  return parseInt(text, 10);\n}\n"
    }
  },
  "adequacy": {
    "file": "src/number.ts",
    "delete": "return parseInt(text, 10);"
  },
  "tell_audit": {
    "critic": "lane-leader adversarial diff read (tests withheld)",
    "verdict": "not-told",
    "notes": "A dropped radix; the base-ten contract is test-only."
  }
}
